{
  "$schema": "https://json-schema.org/draft/2020-12/schema",
  "$id": "https://example.com/youtube-research/result.schema.json",
  "title": "YouTubeResearchResult",
  "type": "object",
  "required": [
    "platform",
    "purpose",
    "subcommand",
    "tool",
    "language",
    "region",
    "period",
    "fetched_at",
    "quota_estimate",
    "items",
    "comments",
    "trends",
    "queries_tried",
    "excluded_summary",
    "limitations",
    "next_human_actions"
  ],
  "properties": {
    "platform": { "const": "youtube" },
    "purpose": { "type": "string" },
    "subcommand": { "type": "string" },
    "tool": { "type": "string" },
    "query": { "type": ["string", "null"] },
    "language": { "type": "string" },
    "region": { "type": "string" },
    "period": { "type": "string" },
    "fetched_at": { "type": "string" },
    "quota_estimate": { "type": "integer", "minimum": 0 },
    "auto_routing": {
      "type": "object",
      "properties": {
        "applied": { "type": "boolean" },
        "from_purpose": { "type": ["string", "null"] },
        "chosen_subcommand": { "type": ["string", "null"] },
        "chosen_defaults": { "type": "object" }
      },
      "additionalProperties": true
    },
    "items": {
      "type": "array",
      "items": { "$ref": "#/$defs/item" }
    },
    "comments": {
      "type": "array",
      "items": { "$ref": "#/$defs/comment" }
    },
    "trends": {
      "type": "array",
      "items": { "$ref": "#/$defs/trend" }
    },
    "queries_tried": {
      "type": "array",
      "items": { "$ref": "#/$defs/queryLog" }
    },
    "excluded_summary": {
      "type": "array",
      "items": { "$ref": "#/$defs/countReason" }
    },
    "limitations": {
      "type": "array",
      "items": { "$ref": "#/$defs/message" }
    },
    "next_human_actions": {
      "type": "array",
      "items": { "$ref": "#/$defs/message" }
    }
  },
  "$defs": {
    "item": {
      "type": "object",
      "required": ["url", "source_id", "author", "title", "metrics", "why_selected", "limitations"],
      "properties": {
        "url": { "type": ["string", "null"] },
        "source_id": { "type": ["string", "null"] },
        "author": { "type": ["string", "null"] },
        "author_url": { "type": ["string", "null"] },
        "published_at": { "type": ["string", "null"] },
        "title": { "type": ["string", "null"] },
        "text": { "type": ["string", "null"] },
        "metrics": {
          "type": "object",
          "properties": {
            "views": { "type": ["integer", "null"] },
            "likes": { "type": ["integer", "null"] },
            "comments": { "type": ["integer", "null"] },
            "subscribers": { "type": ["integer", "null"] },
            "video_count": { "type": ["integer", "null"] }
          },
          "additionalProperties": true
        },
        "matched_terms": { "type": "array", "items": { "type": "string" } },
        "quality_score": { "type": ["number", "null"] },
        "selection_filters": { "type": "array", "items": { "type": "string" } },
        "why_selected": { "type": "string" },
        "limitations": { "type": "array", "items": { "$ref": "#/$defs/message" } }
      },
      "additionalProperties": true
    },
    "comment": {
      "type": "object",
      "required": ["video_id", "comment_id", "text", "order", "why_selected"],
      "properties": {
        "video_id": { "type": "string" },
        "comment_id": { "type": "string" },
        "text": { "type": "string" },
        "author_display_name": { "type": ["string", "null"] },
        "like_count": { "type": ["integer", "null"] },
        "reply_count": { "type": ["integer", "null"] },
        "published_at": { "type": ["string", "null"] },
        "order": { "type": "string" },
        "why_selected": { "type": "string" }
      },
      "additionalProperties": true
    },
    "trend": {
      "type": "object",
      "required": ["keyword", "score", "rising", "related_queries", "region", "period"],
      "properties": {
        "keyword": { "type": "string" },
        "score": { "type": ["number", "null"] },
        "rising": { "type": "boolean" },
        "related_queries": { "type": "array", "items": { "type": "string" } },
        "region": { "type": "string" },
        "period": { "type": "string" }
      },
      "additionalProperties": true
    },
    "queryLog": {
      "type": "object",
      "required": ["endpoint", "quota_cost"],
      "properties": {
        "endpoint": { "type": "string" },
        "query": { "type": ["string", "null"] },
        "quota_cost": { "type": "integer", "minimum": 0 },
        "result_count_before_filter": { "type": ["integer", "null"] },
        "result_count_after_filter": { "type": ["integer", "null"] },
        "memo": { "type": ["string", "null"] }
      },
      "additionalProperties": true
    },
    "countReason": {
      "type": "object",
      "required": ["reason", "count"],
      "properties": {
        "reason": { "type": "string" },
        "count": { "type": "integer", "minimum": 0 }
      },
      "additionalProperties": true
    },
    "message": {
      "type": "object",
      "required": ["code", "message"],
      "properties": {
        "code": { "type": "string" },
        "message": { "type": "string" }
      },
      "additionalProperties": true
    }
  },
  "additionalProperties": true
}
